{
  "event_id": "44444444-4444-4444-8444-444444444444",
  "event_type": "TripCancelled",
  "schema_version": 1,
  "producer": "trip",
  "occurred_at": "2026-10-02T08:00:00Z",
  "correlation_id": "33333333-3333-4333-8333-333333333333",
  "causation_id": "44444444-4444-4444-8444-444444444444",
  "aggregate_id": "11111111-1111-4111-8111-111111111111",
  "aggregate_version": 1,
  "data": {
    "trip_id": "11111111-1111-4111-8111-111111111111",
    "passenger_id": "22222222-2222-4222-8222-222222222222",
    "status": "CANCELLED",
    "trip_version": 1,
    "reason": "example"
  }
}
